{
  "claim_id": "CLM-2026-001",
  "plot_id": "P-0142",
  "outcome_class": "PHENOLOGICAL_BASIS_RISK_GAP",
  "recommended_action": "ESCALATE",
  "failure_mode": "The seasonal rainfall total (341 mm) exceeded the 30th-percentile trigger (290 mm), so the index did not pay. However, a 21-day dry spell from 12 Mar to 1 Apr overlapped the critical flowering stage, causing severe drought damage (leaf rolling 3/3, canopy senescence 2/3, soil cracking). Sentinel-2 NDVI anomaly (z = −1.9) independently confirms vegetation stress. This is a phenological basis-risk gap: the seasonal total masked a critical-window drought.",
  "cited_clause_ids": ["4.2.1", "5.3", "7.1.4"],
  "citations_validated_by_code": true,
  "adjuster_brief": "## Escalation Brief — Claim CLM-2026-001\n\n**Plot:** P-0142, Beed District, Kharif 2025\n**Farmer:** Ramesh Kumar\n**Crop:** Maize (flowering stage)\n\n### Index Outcome\nSeasonal rainfall of 341 mm exceeds the 30th-percentile trigger of 290 mm. The index does **not** pay (Policy §4.2.1).\n\n### Photo Evidence\nTwo photos accepted (one rejected as near-duplicate of CLM-2025-987). Both Gemini passes agree on **SEVERE** damage:\n- Leaf rolling: 3/3 — tightly rolled leaves across the field\n- Canopy senescence: 2/3 — premature yellowing\n- Soil cracking: visible — dry cracked soil between maize rows\n- Damage type: drought\n\n### Independent Evidence\n- **Dry spell:** 21 consecutive days (12 Mar – 1 Apr) overlapping the flowering window\n- **NDVI anomaly:** z = −1.9 (below stress cutoff of −1.5), confirming satellite-detected vegetation stress\n\n### Concordance\n**PHENOLOGICAL_BASIS_RISK_GAP** — the seasonal rainfall total masked a critical-window drought that caused verifiable field-level damage (Policy §5.3). This claim meets the escalation criteria under §7.1.4.\n\n### Recommendation\n**ESCALATE** to senior adjuster for payout consideration under the basis-risk review process.",
  "farmer_messages": {
    "en": "Dear Ramesh, we have received and reviewed the photos from your maize plot P-0142. Our assessment shows significant drought damage during the flowering stage. Although the seasonal rainfall for your area was above the insurance trigger level, the evidence shows your field experienced a prolonged dry spell at a critical time. Your claim has been escalated for further review by a senior claims officer. You will hear from us within 5 working days. Reference: CLM-2026-001."
  }
}
